"asked to pick k indexes,",a,naïve enumeration,algorithm,,
would enumerate all subsets of the candidate indexes of size,,,,,
"k or less, and pick the one with lowest total cost. The naïve",,,,,
enumeration algorithm,guarantees,an,optimal,solution;,
"however, it is not practical, since for realistic values of n and",,,,,
"k (e.g., n=40 and k=10)",the,number,of configurations,,
enumerated is too large,to,make exhaustive,enumeration,,
feasible.,,,,,
For the,given,workload,W,that,consists,of,n
"queries, we generate n workloads W1..Wn each",,,,,,,
"consisting of one query each, where Wi = {Qi}",,,,,,,
For each,workload,"Wi,",we,use,the set,of,
indexable,columns,Ii of,the,query,in Wi,as,
starting candidate indexes.,,,,,,,
Let Ci be,the,configuration,,picked,by index,,
"selection tool for Wi, i.e., Ci = Enumerate",,,,,,"(Ii,",
Wi).,,,,,,,
The candidate index set for W is the union of all,,,,,,,
Ci’s.,,,,,,,
Let S = the best m index configuration using the
naïve enumeration algorithm. If m =  k then exit.
"Pick a new index I such that Cost (S U {I}, W)"
"<= Cost(S U{I’}, W) for any choice of I’ != I"
If Cost (S U {I}) >= Cost(S) then exit
Else S = S U {I}
If |S| = k then exit
Goto 2
"Figure 5. The Greedy(m, k) enumeration algorithm."
Our approach to the configuration enumeration
"problem is to use the Greedy (m, k) algorithm, shown in"
Figure 4. Candidate index selection algorithm.
Figure 5. The algorithm picks an optimal configuration of
size m  (where m <= k) as the “seed”. This seed is then
expanded in a greedy fashion until all k indexes have been
"chosen, or no further reduction in cost is possible by adding"
an index. Each greedy step considers all possible choices for
adding one more index and adds the one resulting in the
"highest cost reduction. Note that at one extreme, if the"
"parameter m = 0, then the algorithm takes a pure greedy"
"approach. On the other hand, if m = k, the algorithm is"
"identical to the naïve enumeration algorithm. Therefore, the"
use of the algorithm is computationally efficient only if m is
"small relative to k.  In such a case, the enumeration exhibits"
near greedy behavior. The value of m relative to k reflects
the desired degree of completeness of enumeration. The
issue of heuristically determining an appropriate value of m
depending on the index interactions among queries in the
workload is discussed in [CN97]. This measure can also be
adjusted by the user of the tool explicitly to vary the nature
of enumeration from quick and heuristic to exhaustive.
Despite the fact that a greedy algorithm can be in principle
"arbitrarily bad for configuration enumeration [CN97], our"
experimental results seem to indicate that a relatively low
value of m produces near-optimal results.
The key reason why a greedy algorithm performs
"well for enumeration is that in many cases, despite"
"interaction among indexes, the largest cost reductions often"
results from indexes that are good candidate indexes by
"themselves. Nonetheless, it is important to capture"
"significant interactions, e.g., merge join using two clustered"
"indexes, single table index intersection. This justifies the"
"exhaustive phase of Greedy (m, k) since it helps capture"
interactions that have the most significant effect on cost. For
"example, observe that for any single query, the join order is"
often determined primarily by sizes of intermediate relations
and presence (or absence) of a few important indexes. Once
"the join order has been determined, additional indexes may"
"come into play, but such indexes only help reduce the cost of"
"a join locally, and do not strongly interact with indexes used"
"in other operations in the execution tree. In such cases, the"
"exhaustive phase of Greedy (m, k) chooses the important"
interacting indexes that affect the join order and
subsequently picks the remaining indexes greedily.
A variant of the enumeration algorithm described
above uses branch-and-bound. The algorithm uses Greedy
"(m, k) with a low predetermined m to generate a"
configuration that serves as a first-cut solution.
"Subsequently, configurations are enumerated exhaustively"
with the constraint that the cost of each partial configuration4
must be within a certain factor of the cost of the
corresponding partial configuration of the first-cut (greedy)
solution. This algorithm is explained in more details and
"compared with Greedy (m, k) in [CN97]"
6. Multi-Column Index Generation
Index selection tools of the past have failed to take
into account the complexity arising from the inclusion of
multi-column indexes. For a given set of k columns on a
"table, k! multi-column indexes are possible, and considering"
all permutations can significantly increase the space of
configurations that must be considered by the tool. In this
"section, we present a technique for dealing with this"
complexity.
We adopt an iterative approach for taking into
account multi-column indexes of increasing width. In the
"first iteration, we only consider single-column indexes."
Based on the single-column indexes picked in the first
"iteration, we select a set of admissible two-column indexes."
"This set of two-column indexes, along with the “winning”"
"single-column indexes, becomes the input for the second"
"iteration5. We use the notation M (a, b) to represent a two-"
column index on the columns a and b where a is the leading
column of the two-column index.
Our strategy for selecting the set of two-column
indexes is based on the intuition that for a two-column index
"to be desirable, a single-column index on its leading column"
must also be desirable. If S is the set of single column
"indexes picked in the first iteration, and a is a column such"
"that an index on this column is in S, then we consider the set"
"S’ of all admissible multi-column indexes of the form M (a,"
b). Note that b must bean indexable column but there may
not be any index in S that is on b. We call this algorithm
MC-LEAD.
We also considered a more aggressive variant of
"MC-LEAD. In this variant, a two-column index M (a, b) is"
considered only if the set S contains an index on a as well on
b. This algorithm is based on the assumption that for a multi-
"column index M (a, b) to be important, single-column"
indexes on both a and b must be important. We refer to this
algorithm as MC-ALL. Note that the set of indexes
considered by MC-ALL is a subset of the indexes considered
"by MC-LEAD. In Section 7, we present a comparison of the"
performance of these algorithms with the scheme where
single-column and multi-column indexes are searched
"together in one pass (i.e., no iterative step). We refer to this"
algorithm as  MC-BASIC.  The results demonstrate that MC-
LEAD is significantly superior.
These strategies for selecting candidate multi-
column indexes are closely related to the technique used by
our tool to consider indexes that help “index-only” access. In
"such cases, while considering M (a, b) above, b need not be"
"an indexable column, but may be part of a projection list in"
the workload that is strongly correlated with the column a.
These details are presented in [CN97].
7. Implementation and Experiments
7.1 Implementation
We have implemented our index selection tool for
Microsoft SQL Server 7.0. The tool takes as input a
workload of SQL DML statements (generated using the
"SQLTrace utility), and generates a set of indexes as output."
"On startup, the tool gathers schema information from the"
7.3.2 Effectiveness of Query Processor Based
Restrictions on Atomic Configurations
In this experiment we show the effectiveness of
using the cost estimates based on single-join atomic
configurations described in Section 3.2.1. We refer to this
pruning technique as SJ in the figures below. We compare
SJ against the cost estimations that do not use any query
processor constraints. We refer to the latter as MJ. Figure 7
shows the comparison in the number of atomic
"configurations evaluated by SJ and MJ. For TPCD_1, the"
reduction in atomic configurations using SJ is not very large
"since the workload consists of only 0, 1, and 2-join queries."
"However, the benefits of SJ for TPCD_2, which consists of"
"3, 4 and 5-join queries, and for TPCD_O which consists of"
many complex queries are 50% and 61% respectively. We
"conclude that for workloads with large join queries, SJ can"
significantly reduce the number of configurations evaluated.
"indexes are selected in both cases. When k is large, most"
indexes that provide any benefit will be included. It is in the
"“Dmroipd dinle q”u raalnitgye  of k that we cNanum ebxepr eocf ta dtoemviica ctioonnfi gbuertawtioenesn SJ"
"caonmdp MareJd. Wto eM nJote however, that the maximum drop in quality"
is quite small (7%). Similar results were observed for other
workloads. We conclude that query processor based
restrictions provide a reasonable method of restricting the set
of atomic configurations that need to be evaluated for a
workload.
7.3.3 Reducing calls to the optimizer.
This experiment shows the extent to which the
number of calls to the optimizer can be reduced through the
optimizations discussed in Section 3.3. We found that the
total reduction in optimizer calls across the workloads varied
from 79% to 92%. While most of the savings were due to
"irrelevant index set optimization (58%-84%), relevant index"
set optimization further reduced the number of optimizer
calls by 9%-29%. The experiment shows that these
optimizations are truly significant.
7.3.4 Performance of Greedy vs. Optimal
"In this experiment we compare Greedy (2, k) with"
the naïve enumeration algorithm (discussed in Section 5).
The naïve enumeration algorithm does an exhaustive search
of the configuration space and therefore finds the optimal
configuration of a given size (we refer to this as Optimal). In
each case Greedy and Optimal were asked to pick 4 indexes
"(k=4). The experiments were run without the query-"
"processor-based-restrictions on atomic configuration, to"
ensure that accurate information of atomic configuration
costs were available.
We observed that the fraction of configurations
enumerated by Greedy as compared to Optimal varied from
"2% to 7% for the different workloads. Recall that Greedy (2,"
k) starts by considering an optimal configuration of size two.
"Nonetheless, when asked to pick four indexes, the exhaustive"
nature of the Optimal causes it to explore a much larger
"space of configurations than Greedy. In all but one workload,"
using Greedy did not compromise optimality. The one
counter-example was TPCD_4 (an update intensive
workload) in which Optimal chose a different clustered index
"for the lineitem table than Greedy. However, the absolute"
difference in cost between the optimal configuration and the
one chosen by Greedy was very small (< 1%).
Our conclusion based on this experiment (and our
experience with Greedy on other databases and workloads) is
"that Greedy (2, k) does very well for a large variety of"
workloads over Microsoft SQL Server.
7.3.5 Multi-Column Index Generation
We compared the algorithms for selecting
admissible multi-column indexes that are described in
Section 6. Figure 9 shows the number of admissible multi-
column indexes picked by each algorithm.
"We note that for most workloads, both techniques"
substantially reduce the number of admissible multi-column
indexes picked when compared to MC-BASIC. Table 3
shows that MC-LEAD performs very well when compared
"with MC-BASIC, whereas MC-ALL suffers a noticeable"
Figure 8. Drop in quality when using SJ as
compared to MJ for TPCD_2.
We now compare the quality of the configuration
picked for each workload when using SJ and MJ
respectively. Our results show that when asked to pick 10
"indexes (k = 10), the configuration picked when using SJ"
was identical to that picked using MJ. To provide intuition
"on why SJ performs well, we designed an experiment where"
the tool was invoked repeatedly with the number of indexes
picked (k) being varied from 2 to 10 for the TPCD_2
"workload. Figure 8 shows that for 2 <= k <= 5, the resulting"
"configurations using SJ and MJ were the same. However,"
the sixth index that is picked when using MJ is the ninth
"index picked when using SJ. Hence for 6 <=k <=8, using SJ"
caused a drop in quality. The intuitive explanation for this
"behavior is that when k is small, the “obviously” good"
drop in,quality,for,two,workloads.,The,success,of,MC-
LEAD confirms the intuition that even if a single column,,,,,,,,
"index on column a is not a “winner”, its interaction with",,,,,,,,
another (winning) column b can be significant enough to,,,,,,,,
"make a multi-column index M (b, a) attractive. MC-LEAD",,,,,,,,
fails only,when,neither,a,nor b is,important,as,a single,
"column index, but M (a, b) is important. We expect that such",,,,,,,,
"cases are relatively rare; and even when they do occur, their",,,,,,,,
impact on the total cost is fairly small in practice as can be,,,,,,,,
seen for TPCD_2 and TPCD_O.,,,,,,,,
We now,compare,the,performance,of,our,algorithm
described above with a “baseline” algorithm. The baseline,,,,,,
algorithm differs from our algorithm in that is non-iterative,,,,,,
and it does not execute the candidate index selection Nstuempb. eIrt of,,,,,,
"",,,,,,col
therefore considers all admissible indexes for the workload,,,,,,
"(including multi-column",,indexes),during,enumeration.,,It
"runs the Greedy (2, k) algorithm, but without imposing any",,,,,,
query processor based restrictions on atomic configurations.,,,,,,
Table 4 shows that in every important category (number of,,,,,,
"candidate indexes,",number,,of optimizer,"calls,",number,of
"configurations enumerated), our algorithm does significantly",,,,,,
less work than the baseline algorithm. The overall running,,,,,,
time of our algorithm improves by a factor of 4 to 10 over,,,,,,
the baseline algorithm.,,"Moreover,",as the,final,column,of
"Table 4 shows, the drop in quality of the final configuration",,,,,,
picked by our algorithm is very small7.,,,,,,
Table 4. Comparison of index selection algorithm to
"“baseline” algorithm."
8. Related Work
There is a substantial body of literature on physical
"database design dating back to the early 70’s. In this section,"
we briefly review representatives of the major directions of
work. Previous work in index selection that takes into
account workload information can be divided into the
following two categories: (1) identifying a set of possible
indexes and configurations for the given workload (2)
searching over the space of possible indexes.
The problem of identifying a set of possible indexes
has been looked at from two angles. Syntactic analysis of the
workload is used to identify potentially useful indexes. This
"is the approach taken in [FST88, HC76]. In [FON92], an"
alternative approach is to generate the set of all
configurations for each query that may be potentially used by
the optimizer and then choose among the union of all such
configurations over the queries in the workload. This
technique is not scalable for large workloads. The framework
by Rozen and Shasha [RS91] suggests generation of a set of
candidate configurations for each query based on a
knowledge-based approach. The set of configurations
explored is the union of only those configurations. This idea
"has been further pursued by [CBC, CBC93] who propose a"
rule-based framework. The knowledge-based approach has
also been taken in the commercial product RdbExpert [HE
91]. Our approach to candidate index selection (Section 4) is
distinct from these approaches.
Table 3. Drop in quality of configuration chosen
compared to MC-BASIC
7.4 Putting It All Together
In this section we summarize our algorithm for index
selection:
1. Run the query-specific-best-configuration
algorithm for identifying candidate indexes. This
requires splitting the given workload of n queries
"into n workloads of one query each, and finding the"
best configuration for each query. The union of
these configurations is the candidate index set for
Step 2.
"2. Run the Greedy (m, k) algorithm to enumerate"
configurations subject to the single-join atomic
configuration pruning technique and select a set of
indexes until the required number of indexes have
been picked or total cost can be reduced no further.
We found that m=2 produced very good solutions.
3. Select a set of admissible multi-column indexes
"using the technique MC-LEAD, based on single-"
column indexes picked in Step 2.
4. Repeat steps 1 and 2 starting with the admissible
index set consisting of single-column indexes that
"were chosen in Step 2, and multi-column indexes"
selected in Step 3.
Figure 10. Summary of index selection algorithm.
The problem of selecting a configuration from the set of
"candidate indexes has two aspects. First, a cost function to"
characterize the goodness of a configuration is needed. In our
"approach and in [FST88], optimizer-cost driven estimates are"
used. An approximate “stand-alone” cost model is used in
"[HC76, CBC]. Next, an efficient search technique that does"
not compromise the quality of the solution is needed.
Several greedy-like search algorithms have been proposed in
"the past. More recently, several variants of greedy algorithms"
have also been recommended in the context of the
"materialized  view and index selection problem. In particular,"
"[HRU96, GHRU97] show bounds on the deviation of the"
"greedy from the optimal. However, their results assume"
"monotonicity, i.e., inclusion of one index does not have any"
impact on the effectiveness of another. By exploiting the
"exhaustive phase of Greedy (m, k), we have been able to"
capture some of the significant index interactions that a
traditional greedy algorithm is unable to capture.
9. Conclusion
Index selection is one important aspect of physical
database design. In this paper we have described our work on
the design and implementation of an index selection tool for
Microsoft SQL Server. The effectiveness of our algorithm
for index selection can be attributed to three novel
techniques that we present in this paper:
"• Query-specific-best-configuration algorithm for"
choosing candidate indexes.
"• An algorithm to reduce the number of atomic"
configurations (and hence number of optimizer
calls) that must be evaluated for a workload.
"• An iterative technique for handling multi-column"
indexes.
Our experimental results show that using these
techniques can increase the overall efficiency of the tool by a
factor of 4 to 10 without significantly compromising the
quality of indexes selected. Our future work will explore
"techniques to choose other structures (e.g., join indexes and"
materialized views) for physical database design in addition
to indexes.
