"An Efficient, Cost-Driven Index Selection Tool for Microsoft SQL Server"
Abstract,,,,,,
In this paper we,describe,novel,techniques,that,make,it
possible to build an industrial-strength tool for automating,,,,,,
the choice of indexes,in the,physical,design,of,a SQL,
"database. The tool takes as input a workload of SQL queries,",,,,,,
and suggests a set of suitable indexes. We ensure that the,,,,,,
indexes chosen are,effective,in reducing,the,cost,of the,
workload by keeping the index selection tool and the query,,,,,,
"optimizer ""in step"". The number of index sets that must be",,,,,,
evaluated to find the optimal configuration is very large. We,,,,,,
reduce the complexity,of,this,problem,using,three,
"techniques. First,",we remove,a large,number,of,spurious,
indexes from consideration by taking into account both query,,,,,,
syntax and cost,information.,,"Second, we",introduce,,
optimizations that make it possible to cheaply evaluate the,,,,,,
"“goodness” of an index set. Third, we describe an iterative",,,,,,
approach to handle,the complexity,,arising,from,multi-,
column indexes.,The tool,has,been implemented,,on,
Microsoft SQL,Server 7.0.,We,performed,extensive,,
"experiments over a range of workloads, including TPC-D.",,,,,,
The results indicate that the tool is efficient and its choices,,,,,,
are close to optimal.,,,,,,
1. Introduction,,,,,,
Enterprise-class,,databases,require,,database,
administrators who are responsible for performance tuning.,,,,,,
With large-scale,deployment,of,"databases,",minimizing,,
database administration,function,,becomes important.,,We,
started the AutoAdmin,research,,project at,Microsoft,,to
investigate new techniques to self-tune and self-administer,,,,,,
database systems to achieve performance competitive with,,,,,,
that of systems that are cared for by database administrators.,,,,,,
One important task of a database administrator is selecting a,,,,,,
physical database design appropriate for the workload of the,,,,,,
system. An important,part,of physical,database,design,,is
selecting indexes.,In this,"paper,",we present,the,novel,
technique that we have developed in the AutoAdmin project,,,,,,
to automate the task of selecting a set of indexes.,,,,,,
The index selection problem has been studied since
the early 70’s and the importance of the problem is well
"recognized. Despite a long history of work in this area, there"
are few research prototypes and commercial products that are
widely deployed. Three basic approaches have been taken to
the index selection problem. The “textbook solutions”
"[CG93] take semantic information such as uniqueness,"
reference constraints and rudimentary statistics (“small” vs.
"“big” tables) and produce a database design. Such designs"
may perform poorly because they ignore valuable workload
information. The second class of tools adopt an expert
"system like approach, where the knowledge of “good”"
designs are encoded as rules and are used to come up with a
design. Such tools can take into account workload
information but suffer from being disconnected from the
query optimizer [HE91]. This has adverse ramifications for
"two reasons. First, a selection of indexes is only as good as"
"the optimizer that uses it. In other words, if the optimizer"
"does not consider a particular index for a query, then its"
"presence in the database does not benefit that query. Second,"
these tools operate on their own model of the query
optimizer’s index usage. While making an accurate model is
"itself hard, ensuring consistency between the tool and an"
evolving optimizer is a software-engineering nightmare.
"In the third approach, the index selection tool uses the"
optimizer’s cost estimates to compare goodness of
alternative hypothetical designs. This approach avoids
asynchrony between the index selection tool and the query
optimizer. This is the approach we have adopted (also
adopted in [FST88]).
1.1 Our Contributions
The AutoAdmin index selection tool that we describe in
"this paper is significant in several ways. First, we have"
recognized that index selection is more than just a difficult
"search problem. Therefore, we have taken an end to end"
systems approach in identifying the building blocks of an
"index selection tool, when the tool uses the optimizer’s cost"
estimates. Implementing the index selection tool has given us
a good understanding of the architectural and system level
"issues. Second, we use a novel search technique that filters"
out spurious indexes in an early stage and exploits
characteristics of the relational query engine to reduce the
cost of selecting indexes. Another novelty of our search
technique is exploring the space of alternative indexes in an
"iterative way such that more complex alternatives (e.g.,"
multi-column indexes) are generated from “good” simpler
"alternatives (e.g., single-column indexes).  Finally, since we"
have fully implemented our tool on Microsoft SQL Server
"7.0 (with necessary server changes), we are able to present"
extensive experimental results. These results demonstrate
3). This module maintains the cost table information shown
in Figure 2. The cost-evaluation module performs
optimizations so that it needs to invoke the optimizer only
for a selected subset of the configurations. Since an index
considered by the search algorithm may not be present in the
"database, the tool also requires the ability to “simulate” the"
presence of the index in the database for the optimizer. The
"“what-if” index creation module provides the tool with an"
interface for specifying this requirement. We have modified
SQL Server to support the creation and loading of a “what-
if” index. A detailed discussion of the required changes to
the server is beyond the scope of this paper.
that our proposed techniques result in an improvement by a
"factor of 4 to 10 in the search time, without significantly"
sacrificing the quality of the result. The experimental results
complement our intuition on the effectiveness of the
strategies proposed in the paper.
2. Overview of Our Approach
2.1 Problem Statement
Our goal is to pick a set of indexes that is suitable for a
given database and workload. An index can be single-column
or multi-column. An index may be either clustered or non-
"clustered, although over any single table, there can be at"
most one clustered index. A workload consists of a set of
"SQL data manipulation statements, i.e., Select, Insert, Delete"
and Update. In this paper we use the term configuration to
mean a set of indexes. We define the size of a configuration
as the number of indexes in the configuration.
"To pick a configuration, we must be able to compare the"
relative goodness of any two configurations. Given a
"configuration and a workload, we use the sum of the"
optimizer estimated costs for all the SQL statements in the
workload as the metric of goodness. We refer to this metric
"as the total cost of a configuration. Given a workload, a"
configuration that has the least value of total cost is called
the optimal configuration.  The goal of an index selection
tool is to pick a configuration that is optimal or as close to
optimal as possible. The index selection process is subject to
"constraints, e.g., an upper bound on the number of indexes or"
"storage space. In this paper, we describe our technique to"
deal with the problem of picking a configuration subject to
an upper bound on the number of indexes.
2.2 Architecture of the Index Selection Tool
An overview of the architecture of our index selection
tool is presented in Figure 1. The dotted line in the figure
denotes the process boundary between the tool and SQL
Server. The index selection tool takes as input a workload on
"a specified database. The tool has a basic search algorithm,"
which iteratively picks more complex index structures. In the
"first iteration, the tool considers only single-column indexes;"
in the second iteration it considers single and two-column
"indexes, and so on. The search algorithm derives its"
"efficiency from each of its three modules. First, the"
candidate index selection module (Section 4) eliminates
"from further consideration, a large number of indexes that"
provide little or no benefit for any query in the workload.
The configuration enumeration module (Section 5)
intelligently searches the space of subsets of candidate
indexes and picks a configuration with low total cost. The
multi-column index generation module selects multi-column
indexes to be considered in the next iteration along with the
indexes chosen by the configuration enumeration module.
The tool has been designed so that any of these modules can
"be replaced with a newer or improved version, without"
having to change any of the remaining modules.
Any index selection tool that bases its choices on
optimizer cost estimates requires the ability to evaluate the
workload for a given configuration. This service is provided
in our architecture by the cost-evaluation module (Section
There are three important measures of the efficiency
of an index selection tool: (1) The number of indexes
considered by the tool for a given workload. (2) The number
of configurations that are enumerated by the index selection
tool. (3) The number of optimizer invocations necessary to
evaluate the total cost for each enumerated configuration.
Any solution to the index selection problem has to be judged
by its efficiency as well as by its quality (how close the
"solution is to the optimal). As we will show in this paper, an"
index selection tool can be made efficient through well-
"designed algorithms, without significantly reducing the"
quality.
2.3 Preliminaries
Indexable columns identify columns in a query that
are potentially useful for indexing. We present a simple
definition of indexable columns here. Indexable columns
form the basis for defining admissible indexes of a workload
which identify the set of all potentially useful indexes for a
workload and provide the starting point for the index
selection tool which picks a subset of these indexes. These
definitions can be easily modified without affecting the rest
"of the index selection tool. In the following definitions, we"
refer to SQL DML statement and “Query” interchangeably.
Definitions:
"(i) An indexable column for a query in the workload is a"
column R.a such that there is a condition of the form R.a
operator Expression in the WHERE clause. The operator
"must be among  {=, <, >, <=, >=, BETWEEN, IN}."
Columns in GROUP BY and ORDER BY clauses are also
"considered indexable. For an Update query, the updated"
columns of the table are considered indexable.
"(ii) An admissible index for a query is an index that is on one"
or more (in case of a multi-column index) indexable columns
of the query.
"(iii) An admissible index for a workload is an index that is an"
admissible index for one or more queries in the workload.
Example 1: Indexable Columns of a Query
Consider the following query Q1:
"SELECT  * FROM onektup, tenktup1"
WHERE (onektup.unique1 = tenktup1.unique1)
AND (tenktup1.unique2 between 0 and 1000)
"From the above definition, it follows that the indexable"
"columns of Q1 are {onektup.unique1, tenktup1.unique1,"
tenktup1.unique2}.
3. Cost Evaluation
"In the naïve approach to evaluating a configuration,"
the cost-evaluator asks the optimizer for a cost estimate for
"each query in the workload. Thus, if there are M"
"configurations and Q queries in the workload, such"
estimation requires asking the SQL Server to optimize M*Q
queries. Invoking the optimizer many times can be expensive
"(despite batching the invocations), since it requires"
communication across process boundaries between the tool
"and the server. In this section, we present techniques that"
result in significantly reducing the number of optimizer calls
through the concept of atomic configurations (cf. [FST 88]).
"Intuitively, a configuration C is atomic for a"
workload if for some query in the workload there is a
possible execution of the query by the query engine that uses
"all indexes in C. In Section 3.1, we show that if a"
"configuration is not atomic for the workload, then we can"
derive the cost of queries for that configuration accurately.
"Therefore, instead of having to evaluate all M configurations"
"(over the space of admissible indexes of the workload), it is"
sufficient to ask the optimizer to evaluate only M’
"configurations among M, as long as all atomic configurations"
are included in M’. Identifying which configurations are to
be included among M’ is crucial for the accuracy and
"efficiency of the tool, and we present two techniques for this"
in Section 3.2.
Another way to reduce optimizer invocation is to
exploit the fact that not every atomic configuration needs to
"be evaluated for every query in the workload. In particular,"
we may be able to estimate the cost of a query Q for an
atomic configuration C by using the cost of the query for a
"“simpler” configuration C’. Section 3.3 describes this"
optimization.
3.1 Deriving Cost of a Configuration from Atomic
Configurations
Let us assume that C is a configuration that is not
atomic and Q is a Select/Update query in the workload.
Consider all atomic configurations Ci of Q that are subsets of
C. One of these configurations must be chosen by the
"optimizer while optimizing Q. Therefore, a well-behaved"
optimizer will choose the atomic configuration from the
"above set that has the minimal cost. Therefore, we can derive"
"Cost (Q, C) = Mini {Cost(Q, Ci)} without invoking the"
"optimizer. Furthermore, since for a Select query, inclusion of"
"an index in a configuration can only reduce cost, it will"
suffice to take the minimum cost over the largest atomic
configurations of Q that are subsets of C.
"If Q is an Insert/Delete Query, the analysis is more"
complex. The cost of an Insert/Delete query for a non-atomic
"configuration C, can be divided in three components. (a)"
Cost of selection  (b) Cost of updating the table and the
indexes that may be used for selection and (c) Cost for
updating indexes that do not affect the selection cost.  We
note that the cost for updating each index in (c) is
independent of each other and can be assumed to be
"independent of the plan chosen for (a) and (b). Therefore, the"
optimizer will pick a plan that minimizes costs for (a) and
"(b). As in a Select/Update query, we can derive T, the"
minimum of the costs over all atomic configurations of Q
that are subsets of C to reflect the components (a) and (b) of
"Cost (Q, C) . To get the cost of updating an index I that is in"
"(c), we look up (Cost (Q, {I}) – Cost (Q, {}). Thus we can"
"estimate the total cost by: T + ∑j (Cost (Q, {Ij}) – Cost (Q,"
"{})) without invoking the optimizer for C."
3.2 Identifying Atomic Configurations
In this section we address the important issue of
identifying atomic configurations for a workload. The total
number of atomic configurations can be very large. In
"particular, for multi-table queries the number of atomic"
configurations is exponential in the number of tables. The
next two sections describe techniques for heuristically
reducing the number of atomic configurations that need to be
considered for a workload without significantly sacrificing
the accuracy of cost estimation.
3.2.1 Query Processor Based Restrictions
The characteristics of the query processor can
influence what constitutes an atomic configuration. We
"that indexes in C interact. In such cases, we will evaluate"
atomic configurations of size n + 1 that extend C. We
formalize this intuition by the following algorithm:
1. n = 2; A = {atomic configurations of size <= 2}.
2. A’={};  Evaluate all configurations in A.
"3. For each configuration C in A, determine if the"
indexes in C interact strongly. We do this by
testing to see if the evaluated cost of the
configuration is at least x% less than its derived
cost.
"4. If C meets the above condition, add all atomic"
configurations of size n+1 that are supersets of C
to A’.
"5. If  A’ = {}, then exit."
"Else A = A’; n = n + 1, Goto Step 2."
Figure 3. Adaptive Detection of  Relevant
Atomic Configurations.
The parameter x defines the threshold of index interaction. If
"the value of x is chosen too small, the risk of too many"
spurious atomic configurations being chosen in Step 4 is
"high. On the other hand, if x is too large, interaction among"
"indexes can go undetected. Therefore, for the algorithm to"
"perform well, choosing an appropriate value of x is"
"important. Due to space constraints, we are unable to provide"
details on how to choose x; we defer this discussion and the
experimental results to [CN97].
3.3 Reducing the Cost of Evaluating Atomic
Configurations
"When evaluating an atomic configuration,"
substantial savings are possible in the number of optimizer
calls by the following optimization. The idea is that when
"asked to evaluate Cost (Q, C), we find a “simpler” atomic"
"configuration C’ such that Cost (Q, C) = Cost (Q, C’)."
Assume that the set of indexable columns for the
"Select/Update query Q3 is P.  Then, only indexes in C that"
are on one or more columns in the set P have effect on the
cost of the query Q. If C’ is the configuration consisting of
"only such indexes then Cost (Q, C) = Cost (Q, C’). If Cost"
"(Q, C’) has already been evaluated, we can simply reuse the"
cost. We refer to this step as the relevant index set
optimization. An extreme case of relevant index set
optimization occurs where the relevant set is empty. In this
"case, the estimated cost for the query is the same as that over"
a database with no indexes. We call this the irrelevant index
set optimization.
Example 3: Reducing calls to the optimizer
Consider the following query Q2:
SELECT * FROM onektup WHERE unique1 < 100
Assume that I1 is an index on onektup.unique1 and
I2 is an index on tenktup1.unique1; we wish to evaluate the
"configuration C = {I1, I2}. The indexable columns of Q2 are"
exploit two widely applicable considerations to restrict the
set of configurations we consider atomic.
"• In any given execution of a query, the query processor"
will only use no more than j indexes per table1 (for some
integer j). This restriction reflects the pragmatic that no
more than a small number of indexes2 may be
intersected to identify tuples of one relation. For query
"engines that do not support index intersection, we can"
strengthen this condition by requiring that no more than
one index per table appear in any atomic configuration.
"• In any given execution of a multi-table query, indexes"
from at most t tables need to be considered for an
atomic configuration. The intuition is that indexes used
in the first few joins of a query have the most impact on
the cost of the query.
"In designing our cost evaluation module, we found that"
values of  j = 2 and t = 2 provide good quality solutions
while dramatically reducing the number of atomic
configurations for complex workloads. We refer to these as
"single-join atomic configurations. It is the search strategy,"
"discussed in Section 5, which determines how and when"
"these atomic configurations are evaluated. In particular, they"
"may be evaluated “on-demand”, i.e., when we are asked to"
"evaluate Cost (Q, C), we evaluate all atomic configurations"
"that are subsets of C, which have not yet been evaluated."
It is possible for search strategies to use different
"values of j and t during enumeration. In fact, we have"
explored a two-tier search strategy where during the first
phase single-join atomic configurations are used. Only
indexes chosen in the first phase are considered in the second
phase but no restrictions on atomic configurations are
"imposed during this phase. Due to space constraints, we"
don’t discuss experimental results of this two-tier search
strategy [CN97].
Example 2. Single-join Atomic Configurations
"Consider a SELECT query with conditions T1.A < 20,"
"T1.A = T2.B, T3.C BETWEEN [30,50], T3.C = T2.B. In this"
"case, one 3-table atomic configuration is (T1.A, T2.B, T3.C)"
since all three indexes may be used together to answer the
"query.  However, due to the single-join atomic configuration"
"based pruning step, the above atomic configuration is not"
"evaluated. Rather, the cost of this query for the 3-table"
configuration is estimated by taking minimum of the costs of
"the atomic configurations: (T1.A, T2.B), (T1.A, T3.C), and"
"(T2.B, T3.C)."
3.2.2 Adaptive Strategy Based on Index Interaction
Our second technique does not make assumptions about
the characteristics of the query processor. Instead it
adaptively detects atomic configurations for a workload
based on interaction among indexes. Assume that an atomic
"configuration C, of size n, has already been evaluated .The"
evaluated cost is compared with the derived cost (using
techniques in Section 3.1). If the evaluated cost is
"significantly different from the derived cost, then it signals"
"{onektup.unique1}. Following",the,above,optimization
"technique, Cost (Q2, C) = Cost (Q2, {I1}). If Cost (Q2, {I1})",,,
"has been evaluated previously, then we save an optimizer",,,
invocation.,,,
4. Candidate Index Selection,,,
If we consider every,admissible,,index of the
"workload, then too many spurious",,indexes,will be
"considered, resulting in a blow",up,of the,space of
configurations that must be enumerated. We now describe,,,
our algorithm for picking the set of candidate indexes from,,,
the space of admissible indexes.,,,
The idea is to determine the best configuration for,,,
"each query independently, and",consider,all,indexes that
belong to one or more of these best configurations as the,,,
candidate index set. The intuition behind this algorithm is,,,
that an index that is not part of the best design for even a,,,
"single query in the workload, is unlikely to be part of the best",,,
design for the entire workload. We refer to this technique as,,,
the query-specific-best-configuration,,candidate,index
"selection algorithm. The challenge, therefore, is to determine",,,
the best configuration for each query Q in the workload.,,,
We now make a key observation about choosing,,,
the best configuration for a query: the problem is no different,,,
than the overall problem of,index,selection,"itself, the"
difference is that the workload consists of exactly one query.,,,
We can therefore obtain the best,configuration,,for each
configuration by using the index selection tool itself! We,,,
now elaborate on this technique.,,,
"Let the workload W be {Q1, .., Qn}. The enumeration",,,
step (described in Section 5) picks the final set of k indexes,,,
"by enumerating configurations over a set, CI, of candidate",,,
"indexes. We denote this step by Enumerate(k, CI, W) where",,,
CI is the set of candidate indexes.  When there are no bounds,,,
"on k, we designate the step by Enumerate (CI, W). Let Ij",,,
denote the indexable columns of the query Qj. We describe,,,
the algorithm in Figure 4 using these notations.,,,
Step 2 of the algorithm shows that for the purpose,,,
"of determining candidate indexes, we consider all indexable",,,
columns of the query as candidates. This is how we avoid,,,
"“cyclic dependence” on the",candidate,index,selection
module.,,,
We comment,on,several,properties,of,this
"algorithm. First, if the workload is free of updates (including",,,,,
"insert and delete statements), and if we do not impose any",,,,,
"bound on the number of indexes that may be chosen, then the",,,,,
configuration chosen by this algorithm has less or equal total,,,,,
cost for the workload compared to any other configuration.,,,,,
"However, if the workload contains updates or if there is a",,,,,
bound on the number,of indexes,to,be chosen,by,the
"algorithm, then this guarantee does not hold. For example,",,,,,
say that the workload,consists,of a,query Q,with,two
"indexable columns T1.C1 and T2.C2, and an insert query U on",,,,,
T1 such that the best configuration for Q consists of an index,,,,,
"on T1.C1 only. In such a case, if the index maintenance cost",,,,,
"predicted for U is high,",then,it is possible,for the,index,
selection tool to not,recommend,any,index since,,the
enumeration phase will not consider T2.C2. Such situations,,,,,
result in inappropriate pruning. A similar observation may be,,,,,
made when we restrict the number of indexes to chosen by,,,,,
the above candidate index selection algorithm.,,,,,
Although generalizations,,of,the algorithm,,are
possible to account for these observations (e.g. modifying,,,,,
Step 3 to pick the “next best” or the top few configuration(s),,,,,
"as well), the basic scheme",did,very,well on a variety,,of
"workloads, including those with updates. This is due to a",,,,,
"couple of factors. First, indexes that are part of the “next",,,,,
best” configuration of,a query,may,appear as,the,best
"configuration for another query in the workload. Also, when",,,,,
"there are multiple indexes selected in the best configuration,",,,,,
there may be considerable overlap between indexes in the,,,,,
"best and the  “next best” configurations. Finally, since Step 3",,,,,
of the algorithm picks configurations without a bound on the,,,,,
"number of indexes, we expect that most indexes from the",,,,,
"“next best” configurations will also find their way into the set",,,,,
of candidate indexes.,,,,,
5. Configuration Enumeration,,,,,
"If there are n candidate indexes, and the tool is",,,,,
